
#1.)
MariaDB [dbms]> SELECT Orders.AcctNum, Orders.OrderNum, SalesRep.SalesFName, SalesRep.SalesLName
    -> FROM Orders
    -> LEFT JOIN SalesRep ON Orders.SalesRepNum = SalesRep.SalesRepNum
    -> ;
+---------+----------+------------+------------+
| AcctNum | OrderNum | SalesFName | SalesLName |
+---------+----------+------------+------------+
| 4552    |        3 | Mike       | Smith      |
| 3679    |        6 | Mike       | Smith      |
| 1234    |       11 | Mike       | Smith      |
| 5623    |       16 | Mike       | Smith      |
| 1234    |        7 | Alice      | Johnson    |
| 5623    |        8 | Alice      | Johnson    |
| 5623    |       12 | Alice      | Johnson    |
| 1234    |       15 | Alice      | Johnson    |
| 4552    |        9 | Mary       | Halvorson  |
| 3679    |       10 | Mary       | Halvorson  |
| 4552    |       13 | Mary       | Halvorson  |
| 3679    |       14 | Mary       | Halvorson  |
| 4552    |       17 | NULL       | NULL       |
+---------+----------+------------+------------+
13 rows in set (0.001 sec)
       
       
#2.)
MariaDB [dbms]> SELECT a.* from Order_Detail a join Order_Detail b ON a.OrderNum = b.OrderNum where a.Prodnum <> b.ProdNum;
+----------+---------+--------------+------+-------+-----------+
| OrderNum | LineNum | ProdNum      | Qty  | Color | UnitPrice |
+----------+---------+--------------+------+-------+-----------+
|        8 |       2 | ridinggloves |    1 | White |     60.00 |
|        8 |       1 | Bike28B      |    1 | Red   |    455.00 |
|       12 |       2 | Helmet       |    1 | Red   |     75.00 |
|       12 |       1 | Bike31A      |    1 | Red   |    525.00 |
+----------+---------+--------------+------+-------+-----------+
4 rows in set (0.001 sec)








#3.)
MariaDB [dbms]> Select a.* FROM Order_Detail a join Orders b ON a.OrderNum = b.OrderNum join SalesRep c ON c.SalesRepNum = b.SalesRepNum WHERE c.SalesLName = 'Halvorson';
+----------+---------+---------+------+--------+-----------+
| OrderNum | LineNum | ProdNum | Qty  | Color  | UnitPrice |
+----------+---------+---------+------+--------+-----------+
|        9 |       1 | Bike28B |    1 | Blue   |    255.00 |
|       10 |       1 | Bike28B |    1 | Green  |    199.00 |
|       13 |       1 | Bike31A |    1 | Blue   |    455.00 |
|       14 |       1 | Bike28  |    1 | Orange |    255.00 |
+----------+---------+---------+------+--------+-----------+
4 rows in set (0.001 sec)




#4.)

#5.) MariaDB [dbms]> SELECT * FROM Orders RIGHT JOIN Order_Detail ON Orders.OrderNum = Order_Detail.OrderNum;
+---------+----------+------------+----------+-------------+----------+---------+----------------------+------+--------+-----------+
| AcctNum | OrderNum | OrderDate  | StoreNum | SalesRepNum | OrderNum | LineNum | ProdNum              | Qty  | Color  | UnitPrice |
+---------+----------+------------+----------+-------------+----------+---------+----------------------+------+--------+-----------+
| 4552    |        3 | 2004-01-03 | 1        | 1           |        3 |       1 | Bike28A              |    1 | Red    |    300.00 |
| 3679    |        6 | 2004-01-05 | 1        | 1           |        6 |       1 | Bike28A              |    1 | Blue   |    259.00 |
| 1234    |        7 | 2004-01-07 | 1        | 2           |        7 |       1 | Bike28A              | NULL | Green  |    525.00 |
| 5623    |        8 | 2004-01-09 | 1        | 2           |        8 |       1 | Bike28B              |    1 | Red    |    455.00 |
| 5623    |        8 | 2004-01-09 | 1        | 2           |        8 |       2 | ridinggloves         |    1 | White  |     60.00 |
| 4552    |        9 | 2004-01-11 | 1        | 3           |        9 |       1 | Bike28B              |    1 | Blue   |    255.00 |
| 3679    |       10 | 2004-01-13 | 1        | 3           |       10 |       1 | Bike28B              |    1 | Green  |    199.00 |
| 1234    |       11 | 2004-01-15 | 1        | 1           |       11 |       1 | Moped77              |    1 | Black  |    955.00 |
| 5623    |       12 | 2004-01-17 | 1        | 2           |       12 |       1 | Bike31A              |    1 | Red    |    525.00 |
| 5623    |       12 | 2004-01-17 | 1        | 2           |       12 |       2 | Helmet               |    1 | Red    |     75.00 |
| 4552    |       13 | 2004-01-19 | 1        | 3           |       13 |       1 | Bike31A              |    1 | Blue   |    455.00 |
| 3679    |       14 | 2004-01-21 | 1        | 3           |       14 |       1 | Bike28               |    1 | Orange |    255.00 |
| 1234    |       15 | 2004-01-23 | 1        | 2           |       15 |       1 | Bike28Cruiser        |    1 | White  |    199.00 |
| 5623    |       16 | 2004-01-25 | 1        | 1           |       16 |       1 | Bike28Schwinn        |    1 | Red    |    955.00 |
| 4552    |       17 | 2004-01-27 | 1        | NULL        |       17 |       1 | SchwinBike28Mountain |    1 | Blue   |    855.00 |
+---------+----------+------------+----------+-------------+----------+---------+----------------------+------+--------+-----------+
15 rows in set (0.001 sec)




#6.)
MariaDB [dbms]> SELECT * FROM Orders LEFT JOIN Order_Detail ON Orders.OrderNum = Order_Detail.OrderNum;
+---------+----------+------------+----------+-------------+----------+---------+----------------------+------+--------+-----------+
| AcctNum | OrderNum | OrderDate  | StoreNum | SalesRepNum | OrderNum | LineNum | ProdNum              | Qty  | Color  | UnitPrice |
+---------+----------+------------+----------+-------------+----------+---------+----------------------+------+--------+-----------+
| 4552    |        3 | 2004-01-03 | 1        | 1           |        3 |       1 | Bike28A              |    1 | Red    |    300.00 |
| 3679    |        6 | 2004-01-05 | 1        | 1           |        6 |       1 | Bike28A              |    1 | Blue   |    259.00 |
| 1234    |        7 | 2004-01-07 | 1        | 2           |        7 |       1 | Bike28A              | NULL | Green  |    525.00 |
| 5623    |        8 | 2004-01-09 | 1        | 2           |        8 |       1 | Bike28B              |    1 | Red    |    455.00 |
| 5623    |        8 | 2004-01-09 | 1        | 2           |        8 |       2 | ridinggloves         |    1 | White  |     60.00 |
| 4552    |        9 | 2004-01-11 | 1        | 3           |        9 |       1 | Bike28B              |    1 | Blue   |    255.00 |
| 3679    |       10 | 2004-01-13 | 1        | 3           |       10 |       1 | Bike28B              |    1 | Green  |    199.00 |
| 1234    |       11 | 2004-01-15 | 1        | 1           |       11 |       1 | Moped77              |    1 | Black  |    955.00 |
| 5623    |       12 | 2004-01-17 | 1        | 2           |       12 |       1 | Bike31A              |    1 | Red    |    525.00 |
| 5623    |       12 | 2004-01-17 | 1        | 2           |       12 |       2 | Helmet               |    1 | Red    |     75.00 |
| 4552    |       13 | 2004-01-19 | 1        | 3           |       13 |       1 | Bike31A              |    1 | Blue   |    455.00 |
| 3679    |       14 | 2004-01-21 | 1        | 3           |       14 |       1 | Bike28               |    1 | Orange |    255.00 |
| 1234    |       15 | 2004-01-23 | 1        | 2           |       15 |       1 | Bike28Cruiser        |    1 | White  |    199.00 |
| 5623    |       16 | 2004-01-25 | 1        | 1           |       16 |       1 | Bike28Schwinn        |    1 | Red    |    955.00 |
| 4552    |       17 | 2004-01-27 | 1        | NULL        |       17 |       1 | SchwinBike28Mountain |    1 | Blue   |    855.00 |
+---------+----------+------------+----------+-------------+----------+---------+----------------------+------+--------+-----------+
15 rows in set (0.001 sec)


#7.)
There is no difference because both tables have the same numbers of tuples, and each unique tuple appears on each table once so Left Join or Right Join will have the same result. 

       
#8.)
mysql> CREATE VIEW ordertop3 AS
    -> select * from orders limit 3;
Query OK, 0 rows affected (0.01 sec)

mysql> select * from ordertop3;
+---------+----------+------------+----------+-------------+
| acctnum | ordernum | orderdate  | storenum | salesrepnum |
+---------+----------+------------+----------+-------------+
| 4552    |        3 | 2004-01-03 | 1        | 1           |
| 3679    |        6 | 2004-01-05 | 1        | 1           |
| 1234    |        7 | 2004-01-07 | 1        | 2           |
+---------+----------+------------+----------+-------------+
3 rows in set (0.00 sec)

#9.)
BEFORE
mysql> select * from orders;
+---------+----------+------------+----------+-------------+
| acctnum | ordernum | orderdate  | storenum | salesrepnum |
+---------+----------+------------+----------+-------------+
| 4552    |        3 | 2004-01-03 | 1        | 1           |
| 3679    |        6 | 2004-01-05 | 1        | 1           |
| 1234    |        7 | 2004-01-07 | 1        | 2           |
| 5623    |        8 | 2004-01-09 | 1        | 2           |
| 4552    |        9 | 2004-01-11 | 1        | 3           |
| 3679    |       10 | 2004-01-13 | 1        | 3           |
| 1234    |       11 | 2004-01-15 | 1        | 1           |
| 5623    |       12 | 2004-01-17 | 1        | 2           |
| 4552    |       13 | 2004-01-19 | 1        | 3           |
| 3679    |       14 | 2004-01-21 | 1        | 3           |
| 1234    |       15 | 2004-01-23 | 1        | 2           |
| 5623    |       16 | 2004-01-25 | 1        | 1           |
| 4552    |       17 | 2004-01-27 | 1        | NULL        |
+---------+----------+------------+----------+-------------+
13 rows in set (0.00 sec)
//AFTER
mysql> insert into orders VALUES (5623, 25, 2004-01-28, 1, 3);
Query OK, 1 row affected, 1 warning (0.00 sec)

mysql> select * from orders;
+---------+----------+------------+----------+-------------+
| acctnum | ordernum | orderdate  | storenum | salesrepnum |
+---------+----------+------------+----------+-------------+
| 4552    |        3 | 2004-01-03 | 1        | 1           |
| 3679    |        6 | 2004-01-05 | 1        | 1           |
| 1234    |        7 | 2004-01-07 | 1        | 2           |
| 5623    |        8 | 2004-01-09 | 1        | 2           |
| 4552    |        9 | 2004-01-11 | 1        | 3           |
| 3679    |       10 | 2004-01-13 | 1        | 3           |
| 1234    |       11 | 2004-01-15 | 1        | 1           |
| 5623    |       12 | 2004-01-17 | 1        | 2           |
| 4552    |       13 | 2004-01-19 | 1        | 3           |
| 3679    |       14 | 2004-01-21 | 1        | 3           |
| 1234    |       15 | 2004-01-23 | 1        | 2           |
| 5623    |       16 | 2004-01-25 | 1        | 1           |
| 4552    |       17 | 2004-01-27 | 1        | NULL        |
| 5623    |       25 | 0000-00-00 | 1        | 3           |
+---------+----------+------------+----------+-------------+
14 rows in set (0.00 sec)

#10.)

//BEFORE
mysql> select * from orders;
+---------+----------+------------+----------+-------------+
| acctnum | ordernum | orderdate  | storenum | salesrepnum |
+---------+----------+------------+----------+-------------+
| 4552    |        3 | 2004-01-03 | 1        | 1           |
| 3679    |        6 | 2004-01-05 | 1        | 1           |
| 1234    |        7 | 2004-01-07 | 1        | 2           |
| 5623    |        8 | 2004-01-09 | 1        | 2           |
| 4552    |        9 | 2004-01-11 | 1        | 3           |
| 3679    |       10 | 2004-01-13 | 1        | 3           |
| 1234    |       11 | 2004-01-15 | 1        | 1           |
| 5623    |       12 | 2004-01-17 | 1        | 2           |
| 4552    |       13 | 2004-01-19 | 1        | 3           |
| 3679    |       14 | 2004-01-21 | 1        | 3           |
| 1234    |       15 | 2004-01-23 | 1        | 2           |
| 5623    |       16 | 2004-01-25 | 1        | 1           |
| 4552    |       17 | 2004-01-27 | 1        | NULL        |
| 5623    |       25 | 0000-00-00 | 1        | 3           |
+---------+----------+------------+----------+-------------+
14 rows in set (0.00 sec)

//AFTER 

mysql> select * from orders;
+---------+----------+------------+----------+-------------+
| acctnum | ordernum | orderdate  | storenum | salesrepnum |
+---------+----------+------------+----------+-------------+
| 4552    |        3 | 2004-01-03 | 1        | 1           |
| 3679    |        6 | 2004-01-05 | 1        | 1           |
| 1234    |        7 | 2004-01-07 | 1        | 2           |
| 5623    |        8 | 2004-01-09 | 1        | 2           |
| 4552    |        9 | 2004-01-11 | 1        | 3           |
| 3679    |       10 | 2004-01-13 | 1        | 3           |
| 1234    |       11 | 2004-01-15 | 1        | 1           |
| 5623    |       12 | 2004-01-17 | 1        | 2           |
| 4552    |       13 | 2004-01-19 | 1        | 3           |
| 3679    |       14 | 2004-01-21 | 1        | 3           |
| 1234    |       15 | 2004-01-23 | 1        | 2           |
| 5623    |       16 | 2004-01-25 | 1        | 1           |
| 4552    |       17 | 2004-01-27 | 1        | NULL        |
| 5623    |       25 | 0000-00-00 | 1        | 3           |
+---------+----------+------------+----------+-------------+
14 rows in set (0.00 sec)

#11.)
//BEFORE
mysql> select * from orders;
+---------+----------+------------+----------+-------------+
| acctnum | ordernum | orderdate  | storenum | salesrepnum |
+---------+----------+------------+----------+-------------+
| 4552    |        3 | 2004-01-03 | 1        | 1           |
| 3679    |        6 | 2004-01-05 | 1        | 1           |
| 1234    |        7 | 2004-01-07 | 1        | 2           |
| 5623    |        8 | 2004-01-09 | 1        | 2           |
| 4552    |        9 | 2004-01-11 | 1        | 3           |
| 3679    |       10 | 2004-01-13 | 1        | 3           |
| 1234    |       11 | 2004-01-15 | 1        | 1           |
| 5623    |       12 | 2004-01-17 | 1        | 2           |
| 4552    |       13 | 2004-01-19 | 1        | 3           |
| 3679    |       14 | 2004-01-21 | 1        | 3           |
| 1234    |       15 | 2004-01-23 | 1        | 2           |
| 5623    |       16 | 2004-01-25 | 1        | 1           |
| 4552    |       17 | 2004-01-27 | 1        | NULL        |
+---------+----------+------------+----------+-------------+
13 rows in set (0.00 sec)

//AFTER

mysql> 
update orders set orderdate = '2004-01-01' where ordernum = 3;
Query OK, 1 row affected (0.00 sec)
Rows matched: 1  Changed: 1  Warnings: 0
mysql> select * from orders;
+---------+----------+------------+----------+-------------+
| acctnum | ordernum | orderdate  | storenum | salesrepnum |
+---------+----------+------------+----------+-------------+
| 4552    |        3 | 2004-01-01 | 1        | 1           |
| 3679    |        6 | 2004-01-05 | 1        | 1           |
| 1234    |        7 | 2004-01-07 | 1        | 2           |
| 5623    |        8 | 2004-01-09 | 1        | 2           |
| 4552    |        9 | 2004-01-11 | 1        | 3           |
| 3679    |       10 | 2004-01-13 | 1        | 3           |
| 1234    |       11 | 2004-01-15 | 1        | 1           |
| 5623    |       12 | 2004-01-17 | 1        | 2           |
| 4552    |       13 | 2004-01-19 | 1        | 3           |
| 3679    |       14 | 2004-01-21 | 1        | 3           |
| 1234    |       15 | 2004-01-23 | 1        | 2           |
| 5623    |       16 | 2004-01-25 | 1        | 1           |
| 4552    |       17 | 2004-01-27 | 1        | NULL        |
+---------+----------+------------+----------+-------------+
13 rows in set (0.00 sec)
    
#12.)mysql> create view ordercustomer as select customer.fname, customer.lname, orders.* from customer inner join   orders on customer.acctnum = orders.acctnum;
Query OK, 0 rows affected (0.01 sec)


mysql> select * from ordercustomer order by ordercustomer.lname;
+-------+---------+---------+----------+------------+----------+-------------+
| fname | lname   | acctnum | ordernum | orderdate  | storenum | salesrepnum |
+-------+---------+---------+----------+------------+----------+-------------+
| Sam   | Goodwin | 3679    |        6 | 2004-01-05 | 1        | 1           |
| Sam   | Goodwin | 3679    |       10 | 2004-01-13 | 1        | 3           |
| Sam   | Goodwin | 3679    |       14 | 2004-01-21 | 1        | 3           |
| Frank | James   | 5623    |       12 | 2004-01-17 | 1        | 2           |
| Frank | James   | 5623    |       16 | 2004-01-25 | 1        | 1           |
| Frank | James   | 5623    |        8 | 2004-01-09 | 1        | 2           |
| Marge | Toledo  | 1234    |       15 | 2004-01-23 | 1        | 2           |
| Marge | Toledo  | 1234    |        7 | 2004-01-07 | 1        | 2           |
| Marge | Toledo  | 1234    |       11 | 2004-01-15 | 1        | 1           |
| Heidi | Wonder  | 4552    |        9 | 2004-01-11 | 1        | 3           |
| Heidi | Wonder  | 4552    |       13 | 2004-01-19 | 1        | 3           |
| Heidi | Wonder  | 4552    |        3 | 2004-01-01 | 1        | 1           |
| Heidi | Wonder  | 4552    |       17 | 2004-01-27 | 1        | NULL        |
+-------+---------+---------+----------+------------+----------+-------------+
13 rows in set (0.00 sec)

#13.)mysql> create view first as select product.prodname, product.prodsupy, product.colorgrp, product.prodcost, order_detail.* from product inner join order_detail on product.prodnum = order_detail.prodnum order by order_detail.ordernum DESC;
Query OK, 0 rows affected (0.00 sec)

mysql> select * from first;
+-------------------------+---------------+----------+----------+----------+---------+----------------------+------+--------+-----------+
| prodname                | prodsupy      | colorgrp | prodcost | ordernum | linenum | prodnum              | qty  | color  | unitprice |
+-------------------------+---------------+----------+----------+----------+---------+----------------------+------+--------+-----------+
| Schwinn28InMountainBike | Schwinn       | 8colors  |     NULL |       17 |       1 | SchwinBike28Mountain |    1 | Blue   |    855.00 |
| Schwinn28InBike         | Schwinn       | 8colors  |     NULL |       16 |       1 | Bike28Schwinn        |    1 | Red    |    955.00 |
| Cruiser28InBike         | AmBike        | 8colors  |     NULL |       15 |       1 | Bike28Cruiser        |    1 | White  |    199.00 |
| standard29InBike        | Generic       | 8colors  |     NULL |       14 |       1 | Bike28               |    1 | Orange |    255.00 |
| Trek31InBike            | Trek          | 8colors  |     NULL |       13 |       1 | Bike31A              |    1 | Blue   |    455.00 |
| standardhelmet          | AmManuf       | RWB      |     NULL |       12 |       2 | Helmet               |    1 | Red    |     75.00 |
| Trek31InBike            | Trek          | 8colors  |     NULL |       12 |       1 | Bike31A              |    1 | Red    |    525.00 |
| Moped77KPN              | KPNEnterprise | WhtBlk   |     NULL |       11 |       1 | Moped77              |    1 | Black  |    955.00 |
| Speedo28InBike          | Speedo        | 8colors  |     NULL |       10 |       1 | Bike28B              |    1 | Green  |    199.00 |
| Speedo28InBike          | Speedo        | 8colors  |     NULL |        9 |       1 | Bike28B              |    1 | Blue   |    255.00 |
| Speedo28InBike          | Speedo        | 8colors  |     NULL |        8 |       1 | Bike28B              |    1 | Red    |    455.00 |
| standardRidingGloves    | RidingSuppInc | WhtBlk   |     NULL |        8 |       2 | ridinggloves         |    1 | White  |     60.00 |
| Trek28InBike            | Trek          | 8colors  |     NULL |        7 |       1 | Bike28A              | NULL | Green  |    525.00 |
| Trek28InBike            | Trek          | 8colors  |     NULL |        6 |       1 | Bike28A              |    1 | Blue   |    259.00 |
| Trek28InBike            | Trek          | 8colors  |     NULL |        3 |       1 | Bike28A              |    1 | Red    |    300.00 |
+-------------------------+---------------+----------+----------+----------+---------+----------------------+------+--------+-----------+
15 rows in set (0.00 sec)
    

   
